"arten","funk","d","f","i","e","dim","model"
"533","","Darlehen und Beteiligungen n.a.g., öffentliche Sozialversicherungen","Prêts et participations n.c.a., assurances sociales publiques","Mutui e partecipazioni n.m.a., assicurazioni sociali pubbliche","Loans and financial interests n.e.c., social security funds","ausgaben","fs"
"534","","Darlehen und Beteiligungen n.a.g., öffentliche Unternehmen","Prêts et participations n.c.a., entreprises publiques","Mutui e partecipazioni n.m.a., imprese pubbliche","Loans and financial interests n.e.c., public corporations","ausgaben","fs"
"535","","Darlehen und Beteiligungen n.a.g., private Unternehmen","Prêts et participations n.c.a., entreprises privées","Mutui e partecipazioni n.m.a., imprese private","Loans and financial interests n.e.c., private corporations","ausgaben","fs"
"536","","Darlehen und Beteiligungen n.a.g., private Organisationen ohne Erwerbszweck","Prêts et participations n.c.a., organisations privées à but non lucratif","Mutui e partecipazioni n.m.a., organizzazioni private senza scopo di lucro","Loans and financial interests n.e.c., private non-profit organizations","ausgaben","fs"
"537","","Darlehen und Beteiligungen n.a.g., private Haushalte","Prêts et participations n.c.a., ménages privés","Mutui e partecipazioni n.m.a., economie domestiche private","Loans and financial interests n.e.c., households","ausgaben","fs"
"538","","Darlehen und Beteiligungen n.a.g., Ausland","Prêts et participations n.c.a., étranger","Mutui e partecipazioni n.m.a., estero","Loans and financial interests n.e.c., abroad","ausgaben","fs"
"54","","Darlehen","Prêts","Mutui","Loans","ausgaben","fs"
"540","","Darlehen, Bund","Prêts, Confédération","Mutui, Confederazione","Loans, Confederation","ausgaben","fs"
"541","","Darlehen, Kantone und Konkordate","Prêts, cantons et concordats","Mutui, Cantoni e Concordati","Loans, cantons and concordats","ausgaben","fs"
"542","","Darlehen, Gemeinden und Gemeindezweckverbände","Prêts, communes et syndicats intercommunaux","Mutui, Comuni e consorzi comunali","Loans, municipalities and special purpose entities","ausgaben","fs"
"543","","Darlehen, öffentliche Sozialversicherungen","Prêts, assurances sociales publiques","Mutui, assicurazioni sociali pubbliche","Loans, social security funds","ausgaben","fs"
"544","","Darlehen, öffentliche Unternehmen","Prêts, entreprises publiques","Mutui, imprese pubbliche","Loans, public corporations","ausgaben","fs"
"545","","Darlehen, private Unternehmen","Prêts, entreprises privées","Mutui, imprese private","Loans, private corporations","ausgaben","fs"
"546","","Darlehen, private Organisationen ohne Erwerbszweck","Prêts, organisations privées à but non lucratif","Mutui, organizzazioni private senza scopo di lucro","Loans, private non-profit organizations","ausgaben","fs"
"547","","Darlehen, private Haushalte","Prêts, ménages privés","Mutui, economie domestiche private","Loans, households","ausgaben","fs"
"548","","Darlehen, Ausland","Prêts, étranger","Mutui, estero","Loans, abroad","ausgaben","fs"
"549","","Studiendarlehen","Prêts d'études","Prestiti di studio","Study loans","ausgaben","fs"
"55","","Beteiligungen und Grundkapitalien","Participations et capital social","Partecipazioni e capitali sociali","Financial interests and share capital","ausgaben","fs"
"550","","Beteiligungen und Grundkapitalien, Bund","Participations/capital social, Confédération","Partecipazioni e capitali sociali, Confederazione","Financial interests/share capital, Confederation","ausgaben","fs"
"551","","Beteiligungen und Grundkapitalien, Kantone und Konkordate","Participations/capital social, cantons et concordats","Partecipazioni e capitali sociali, Cantoni e Concordati","Financial interests/share capital, cantons and concordats","ausgaben","fs"
"552","","Beteiligungen und Grundkapitalien, Gemeinden und Gemeindezweckverbände","Participations/capital social, communes et syndicats intercommunaux","Partecipazioni e capitali sociali, Comuni e consorzi comunali","Financial interests/share capital, municipalities and special purpose entities","ausgaben","fs"
"553","","Beteiligungen und Grundkapitalien, öffentliche Sozialversicherungen","Participations/capital social, assurances sociales publiques","Partecipazioni e capitali sociali, assicurazioni sociali pubbliche","Financial interests/share capital, social security funds","ausgaben","fs"
"554","","Beteiligungen und Grundkapitalien, öffentliche Unternehmen","Participations/capital social, entreprises publiques","Partecipazioni e capitali sociali, imprese pubbliche","Financial interests/share capital, public corporations","ausgaben","fs"
"555","","Beteiligungen und Grundkapitalien, private Unternehmen","Participations/capital social, entreprises privées","Partecipazioni e capitali sociali, imprese private","Financial interests/share capital, private corporations","ausgaben","fs"
"556","","Beteiligungen und Grundkapitalien, private Organisationen ohne Erwerbszweck","Participations/capital social, organisations privées à but non lucratif","Partecipazioni e capitali sociali, organizzazioni private senza scopo di lucro","Financial interests/share capital, private non-profit organizations","ausgaben","fs"
"557","","Beteiligungen und Grundkapitalien, private Haushalte","Participations/capital social, ménages privés","Partecipazioni e capitali sociali, economie domestiche","Financial interests/share capital, households","ausgaben","fs"
"558","","Beteiligungen und Grundkapitalien, Ausland","Participations/capital social, étranger","Partecipazioni e capitali sociali, estero","Financial interests/share capital, abroad","ausgaben","fs"
"57","","Investitionsbeiträge","Contributions à des investissements","Contributi agli investimenti","Investment contributions","ausgaben","fs"
"570","","Investitionsbeiträge, Bund","Contributions à des investissements, Confédération","Contributi agli investimenti, Confederazione","Investment contributions, Confederation","ausgaben","fs"
"571","","Investitionsbeiträge, Kantone und Konkordate","Contributions à des investissements, cantons et concordats","Contributi agli investimenti, Cantoni e Concordati","Investment contributions, cantons and concordats","ausgaben","fs"
"572","","Investitionsbeiträge, Gemeinden und Gemeindezweckverbände","Contributions à des investissements, communes et syndicats intercommunaux","Contributi agli investimenti, Comuni e consorzi comunali","Investment contributions, municipalities and special purpose entities","ausgaben","fs"
"573","","Investitionsbeiträge, öffentliche Sozialversicherungen","Contributions à des investissements, assurances sociales publiques","Contributi agli investimenti, assicurazioni sociali pubbliche","Investment contributions, social security funds","ausgaben","fs"
"574","","Investitionsbeiträge, öffentliche Unternehmen","Contributions à des investissements, entreprises publiques","Contributi agli investimenti, imprese pubbliche","Investment contributions, public corporations","ausgaben","fs"
"575","","Investitionsbeiträge, private Unternehmen","Contributions à des investissements, entreprises privées","Contributi agli investimenti, imprese private","Investment contributions, private corporations","ausgaben","fs"
"576","","Investitionsbeiträge, private Organisationen ohne Erwerbszweck","Contributions à des investissements, organisations privées à but non lucratif","Contributi agli investimenti, organizzazioni private senza scopo di lucro","Investment contributions, private non-profit organizations","ausgaben","fs"
"577","","Investitionsbeiträge, private Haushalte","Contributions à des investissements, ménages privés","Contributi agli investimenti, economie domestiche private","Investment contributions, households","ausgaben","fs"
"578","","Investitionsbeiträge, Ausland","Contributions à des investissements, étranger","Contributi agli investimenti, estero","Investment contributions, abroad","ausgaben","fs"
"58","","Ausserordentliche Investitionsausgaben","Dépenses d'investissement extraordinaires","Uscite straordinarie per investimenti","Extraordinary investment expenditure","ausgaben","fs"
"580","","Ausserordentliche Investitionen für Sachanlagen","Investissements extraordinaires pour les immobilisations corporelles","Investimenti materiali straordinari","Extraordinary investments for tangible fixed assets","ausgaben","fs"
"582","","Ausserordentliche Investitionen für immaterielle Anlagen","Investissements extraordinaires pour les immobilisations incorporelles","Investimenti immateriali straordinari","Extraordinary investments for intangible fixed assets","ausgaben","fs"
"584","","Ausserordentliche Investitionen für Darlehen","Investissements extraordinaires pour les prêts","Investimenti straordinari per mutui","Extraordinary investments for loans","ausgaben","fs"
"585","","Ausserordentliche Investitionen für Beteiligungen und Grundkapitalien","Investissements extraordinaires pour les participations et le capital social","Investimenti straordinari per partecipazioni e capitali sociali","Extraordinary investments for financial interests and share capital","ausgaben","fs"
"587","","Ausserordentliche Investitionsbeiträge","Contributions extraordinaires à des investissements","Contributi agli investimenti straordinari","Extraordinary investment contributions","ausgaben","fs"
"5870","","Ausserordentliche Investitionsbeiträge, Bund","Contributions extraordinaires à des investissements, Confédération","Contributi agli investimenti straordinari, Confederazione","Extraordinary investment contributions, Confederation","ausgaben","fs"
"5871","","Ausserordentliche Investitionsbeiträge, Kantone und Konkordate","Contributions extraordinaires à des investissements, cantons et concordats","Contributi agli investimenti straordinari, Cantoni e Concordati","Extraordinary investment contributions, cantons and concordats","ausgaben","fs"
"5872","","Ausserordentliche Investitionsbeiträge, Gemeinden und Gemeindezweckverbände","Contributions extraordinaires à des investissements, communes et syndicats intercommunaux","Contributi agli investimenti straordinari, Comuni e consorzi comunali","Extraordinary investment contributions, municipalities and special purpose entities","ausgaben","fs"
"5873","","Ausserordentliche Investitionsbeiträge, öffentliche Sozialversicherungen","Contributions extraordinaires à des investissements, assurances sociales publiques","Contributi agli investimenti straordinari, assicurazioni sociali pubbliche","Extraordinary investment contributions, social security funds","ausgaben","fs"
"5874","","Ausserordentliche Investitionsbeiträge, öffentliche Unternehmen","Contributions extraordinaires à des investissements, entreprises publiques","Contributi agli investimenti straordinari, imprese pubbliche","Extraordinary investment contributions, public corporations","ausgaben","fs"
"5875","","Ausserordentliche Investitionsbeiträge, private Unternehmen","Contributions extraordinaires à des investissements, entreprises privées","Contributi agli investimenti straordinari, imprese private","Extraordinary investment contributions, private corporations","ausgaben","fs"
"5876","","Ausserordentliche Investitionsbeiträge, private Organisationen","Contributions extraordinaires à des investissements, organisations privées","Contributi agli investimenti straordinari, organizzazioni private","Extraordinary investment contributions, private organizations","ausgaben","fs"
"5877","","Ausserordentliche Investitionsbeiträge, private Haushalte","Contributions extraordinaires à des investissements, ménages privés","Contributi agli investimenti straordinari, economie domestiche private","Extraordinary investment contributions, households","ausgaben","fs"
"5878","","Ausserordentliche Investitionsbeiträge, Ausland","Contributions extraordinaires à des investissements, étranger","Contributi agli investimenti straordinari, estero","Extraordinary investment contributions, abroad","ausgaben","fs"
"589","","Übrige ausserordentliche Investitionen","Autres investissements extraordinaires","Rimanenti investimenti straordinari","Other extraordinary investments","ausgaben","fs"