"arten","funk","d","f","i","e","dim","model"
"","","Gesamtausgaben","Dépenses totales","Uscite totali","Total expenditure","ausgaben","fs"
"3","","Ausgaben","Dépenses","Uscite","Expenditure","ausgaben","fs"
"30","","Personalausgaben","Dépenses de personnel","Uscite per il personale","Personnel expenditure","ausgaben","fs"
"300","","Behörden, Kommissionen und Richter","Autorités, commissions et juges","Autorità, commissioni e giudici","Authorities, commissions and judges","ausgaben","fs"
"301","","Löhne des Verwaltungs- und Betriebspersonals","Salaires du personnel administratif et d'exploitation","Stipendi del personale amministrativo e d'esercizio","Salaries of administrative and operating personnel","ausgaben","fs"
"302","","Löhne der Lehrpersonen","Salaires des enseignants","Stipendi del corpo docenti","Salaries of teaching staff","ausgaben","fs"
"303","","Temporäre Arbeitskräfte","Travailleurs temporaires","Personale temporaneo","Temporary staff","ausgaben","fs"
"304","","Zulagen","Allocations","Assegni e indennità","Allowances","ausgaben","fs"
"305","","Arbeitgebendenbeiträge","Cotisations de l'employeur","Contributi del datore di lavoro","Employer contributions","ausgaben","fs"
"306","","Arbeitgebendenleistungen","Prestations de l'employeur","Prestazioni del datore di lavoro","Employer benefits","ausgaben","fs"
"309","","Übrige Personalausgaben","Autres dépenses de personnel","Rimanenti uscite per il personale","Other personnel expenditure","ausgaben","fs"
"31","","Sach- und übrige Betriebsausgaben","Dépenses de biens et services et autres dépenses d'exploitation","Uscite per beni e servizi e altre uscite d’esercizio","General, administrative and operating expenditure","ausgaben","fs"
"310","","Material- und Warenausgaben","Dépenses de matériel et de marchandises","Uscite per materiale e merci","Cost of goods and materials","ausgaben","fs"
"311","","Nicht aktivierbare Anlagen","Immobilisations non portées à l'actif","Investimenti non attivabili","Non-capitalized assets","ausgaben","fs"
"312","","Ver- und Entsorgung","Approvisionnement et élimination","Approvvigionamento e smaltimento","Supply and disposal","ausgaben","fs"
"313","","Dienstleistungen und Honorare","Prestations de service et honoraires","Prestazioni di servizi e onorari","Services and fees","ausgaben","fs"
"314","","Baulicher Unterhalt","Travaux d'entretien","Manutenzione edile","Building maintenance","ausgaben","fs"
"315","","Unterhalt Mobilien und immaterielle Anlagen","Entretien des biens meubles et immobilisations incorporelles","Manutenzione di beni mobili e investimenti immateriali","Upkeep of movables and intangible fixed assets","ausgaben","fs"
"316","","Mieten, Leasing, Pachten, Benützungskosten","Loyers, leasing, baux à ferme, frais d'utilisation","Pigioni, leasing, fitti, costi di utilizzazione","Rental, lease, tenancy, user charges","ausgaben","fs"
"317","","Spesenentschädigungen","Remboursement des frais","Indennità per il rimborso spese","Compensation for expenditure","ausgaben","fs"
"318","","Wertberichtigungen auf Forderungen","Réévaluation de créances","Rettificazioni di valore su crediti","Value adjustments on receivables","ausgaben","fs"
"319","","Übrige Betriebsausgaben","Autres dépenses d'exploitation","Rimanenti uscite d'esercizio","Other operating expenditure","ausgaben","fs"
"32","","Rüstungsausgaben","Dépenses d'armement","Uscite per l'armamento","Defense expenditure","ausgaben","fs"
"320","","Rüstungsausgaben","Dépenses d'armement","Uscite per l'armamento","Defense expenditure","ausgaben","fs"
"34","","Finanzausgaben","Dépenses financières","Uscite finanziarie","Financial expenditure","ausgaben","fs"
"340","","Zinsausgaben","Dépenses d'intérêts","Uscite a titolo di interessi","Interest expenditure","ausgaben","fs"
"341","","Realisierte Verluste FV","Pertes réalisées PF","Perdite conseguite beni patrimoniali","Realized losses NAA","ausgaben","fs"
"342","","Kapitalbeschaffung und -verwaltung","Acquisition et administration de capital","Raccolta e gestione di capitale","Capital procurement and administration","ausgaben","fs"
"343","","Liegenschaftenausgaben, FV","Dépenses d'immeubles, PF","Uscite per immobili, beni patrimoniali","Real estate expenditure, NAA","ausgaben","fs"
"349","","Übrige Finanzausgaben","Autres dépenses financières","Rimanenti uscite finanziarie","Other financial expenditure","ausgaben","fs"
"36","","Transferausgaben","Dépenses de transfert","Uscite di riversamento","Transfer expenditure","ausgaben","fs"
"360","","Einnahmensanteile","Parts de recettes","Partecipazioni a entrate","Revenue shares","ausgaben","fs"
"3600","","Einnahmensanteile an Bund","Parts de recettes destinées à la Confédération","Partecipazioni della Confederazione a entrate","Revenue shares for the Confederation","ausgaben","fs"
"3601","","Ertragsanteile an Kantone und Konkordate","Parts de recettes destinées aux cantons et aux concordats","Partecipazioni di Cantoni e Concordati a entrate","Revenue shares for cantons and concordats","ausgaben","fs"
"36010","","Ertragsanteil direkte Bundessteuer","Part des recettes de l'impôt fédéral direct","Partecipazioni a ricavi, imposta federale diretta","Share in direct federal tax revenue","ausgaben","fs"
"36011","","Ertragsanteil Verrechnungssteuer","Part des recettes de l'impôt anticipé","Partecipazioni a ricavi, imposta preventiva","Share in withholding tax revenue","ausgaben","fs"
"36012","","Ertragsanteil Wehrpflichtersatzabgabe","Part des recettes de la taxe d'exemption de l'obligation de servir","Partecipazioni a ricavi, tassa d'esenzione dall'obbligo militare","Share in military service exemption tax revenue","ausgaben","fs"
"36013","","Ertraganteil Eidg. Alkoholverwaltung","Part des recettes de la Régie fédérale des alcools","Partecipazioni a ricavi, Regìa federale degli alcool","Share in Swiss Alcohol Board revenue","ausgaben","fs"
"36014","","Ertraganteil Eidg. Bussen und Taxen","Part des recettes des amendes et taxes fédérales","Partecipazioni a ricavi, multe e tasse federali","Share in revenue from federal fines and duties","ausgaben","fs"
"36015","","Ertraganteil Eidg. Mineralölsteuer","Part des recettes de l'impôt fédéral sur les huiles minérales","Partecipazioni a ricavi, imposta federale sugli oli minerali","Share in federal mineral oil tax revenue","ausgaben","fs"
"36016","","Ertraganteil Eidg. Stempelabgabe","Part des recettes des droits de timbre fédéraux","Partecipazioni a ricavi, tasse di bollo federali","Share in federal stamp duty revenue","ausgaben","fs"
"36017","","Ertraganteil EU-Zinsbesteuerung","Part des recettes de la fiscalité de l'épargne UE","Partecipazioni a ricavi, fiscalità del risparmio UE","Share in EU savings tax revenue","ausgaben","fs"
"36018","","Ertraganteil LSVA","Part des recettes de la RPLP","Partecipazioni a ricavi, TTPCP","Share in mileage-related heavy vehicle charge revenue","ausgaben","fs"
"36019","","Ertraganteil übriger Bundeseinnahmen","Part des autres recettes de la Confédération","Partecipazioni a ricavi, rimanenti entrate della Confederazione","Share in revenue from other federal receipts","ausgaben","fs"
"3602","","Einnahmensanteile Gemeinden und Gemeindezweckverbände","Parts de recettes destinées aux communes et syndicats intercommunaux","Partecipazioni di Comuni e consorzi comunali a entrate","Revenue shares for municipalities and special purpose entities","ausgaben","fs"
"36021","","Gemeindeanteile an kantonalen Steuern","Parts des impôts cantonaux revenant aux communes","Partecipazioni di Comuni alle imposte cantonali","Municipalities' share in cantonal taxes","ausgaben","fs"
"36022","","Gemeindeanteile an Regalien und Konzessionen","Parts des patentes et concessions revenant aux communes","Partecipazioni di Comuni a regalie e concessioni","Municipalities' share in royalties and concessions","ausgaben","fs"
"36023","","Gemeindeanteile an kantonalen Gebühren","Parts des émoluments cantonaux revenant aux communes","Partecipazioni di Comuni a emolumenti cantonali","Municipalities' share in cantonal fees","ausgaben","fs"
"36029","","Gemeindeanteile an übrigen kantonalen Einnahmen","Parts des autres recettes cantonales revenant aux communes","Partecipazioni di Comuni alle rimanenti entrate cantonali","Municipalities' share in other cantonal receipts","ausgaben","fs"
"3603","","Einnahmensanteile an öffentlichen Sozialversicherungen","Parts de recettes destinées aux assurances sociales publiques","Partecipazioni di assicurazioni sociali pubbliche a entrate","Revenue shares for social security funds","ausgaben","fs"
"3604","","Einnahmensanteile an öffentlichen Unternehmen","Parts de recettes destinées aux entreprises publiques","Partecipazioni di imprese pubbliche a entrate","Revenue shares for public corporations","ausgaben","fs"
"361","","Entschädigungen","Indemnités","Indennizzi","Compensation","ausgaben","fs"
"3610","","Entschädigungen an Bund","Indemnités à la Confédération","Indennizzi alla Confederazione","Compensation for the Confederation","ausgaben","fs"
"3611","","Entschädigungen an Kantone und Konkordate","Indemnités aux cantons et aux concordats","Indennizzi a Cantoni e Concordati","Compensation for cantons and concordats","ausgaben","fs"
"3612","","Entschädigungen an Gemeinden und Gemeindezweckverbände","Indemnités aux communes et aux syndicats intercommunaux","Indennizzi a Comuni e consorzi comunali","Compensation for municipalities and special purpose entities","ausgaben","fs"
"3613","","Entschädigungen an öffentliche Sozialversicherungen","Indemnités aux assurances sociales publiques","Indennizzi ad assicurazioni sociali pubbliche","Compensation for social security funds","ausgaben","fs"
"3614","","Entschädigungen an öffentlichen Unternehmen","Indemnités aux entreprises publiques","Indennizzi a imprese pubbliche","Compensation for public corporations","ausgaben","fs"
"362","","Finanz- und Lastenausgleich","Péréquation financière et compensation des charges","Perequazione finanziaria e compensazione degli oneri","Fiscal equalization and cost compensation","ausgaben","fs"
"3620","","Finanz- und Lastenausgleich an Bund","Péréquation financière et compensation des dépenses à la Confédération","Perequazione finanziaria e compensazione degli oneri alla Confederazione","Fiscal equalization and cost compensation for the Confederation","ausgaben","fs"
"3621","","Finanz- und Lastenausgleich an Kantone","Péréquation financière et compensation des charges aux cantons","Perequazione finanziaria e compensazione degli oneri a Cantoni e concordati","Fiscal equalization and cost compensation for cantons","ausgaben","fs"
"36211","","Ressourcenausgleich","Péréquation des ressources","Perequazione delle risorse","Resource equalization","ausgaben","fs"
"36212","","Sozio-demografischer Lastenausgleich","Compensation des charges excessives dues à des facteurs socio-démographiques","Compensazione degli oneri eccessivi dovuti a fattori sociodemografici","Socio-demographic cost compensation","ausgaben","fs"
"36213","","Geografisch-topografischer Lastenausgleich","Compensation des charges excessives dues à des facteurs géo-topographiques","Compensazione degli oneri eccessivi dovuti a fattori geotopografici","Geographical/topographic cost compensation","ausgaben","fs"
"36214","","Härteausgleich","Compensation des cas de rigueur","Compensazione dei casi di rigore","Cohesion fund","ausgaben","fs"
"36215","","Vertikaler Finanzausgleich von Gemeinde an Kanton","Péréquation financière verticale des communes au canton","Perequazione finanziaria verticale da Comuni a Cantone","Vertical fiscal equalization between municipalities and cantons","ausgaben","fs"
"36216","","Vertikaler Lastenausgleich von Gemeinde an Kanton","Compensation verticale des charges des communes au canton","Compensazione verticale degli oneri da Comuni a Cantone","Vertical cost compensation between municipalities and cantons","ausgaben","fs"
"36217","","Weitergabe Ressourcen- und Härteausgleich der Geberkantone","Transmission de la péréquation des ressources et compensation des cas de rigueur des cantons contributeurs","Trasferimento dai Cantoni donatori della perequazione delle risorse e compensazione dei casi di rigore","Forwarding of resource equalization and cohesion fund from donor cantons","ausgaben","fs"
"36219","","Übrige Massnahmen des Finanzausgleichs","Autres mesures liées à la péréquation financière","Rimanenti misure della perequazione finanziaria","Other measures of the fiscal equalization","ausgaben","fs"
"3622","","Finanz- und Lastenausgleich an Gemeinden","Péréquation financière et compensation des charges aux communes","Perequazione finanziaria e compensazione degli oneri a Comuni","Fiscal equalization and cost compensation for municipalities","ausgaben","fs"
"36221","","Weitergabe eines Anteils am Ressourcenausgleich an Gemeinden","Transmission d'une part de la péréquation des ressources aux communes","Trasferimento ai Comuni di una percentuale della perequazione delle risorse","Forwarding of a share in resource equalization to municipalities","ausgaben","fs"
"36222","","Weitergabe eines Anteils am sozio-demografischen Ausgleich an Gemeinden","Transmission d'une part de la compensation des charges excessives dues à des facteurs socio-démographiques aux communes","Trasferimento ai Comuni di una percentuale della perequazione sociodemografica","Forwarding of a share in socio-demographic equalization to municipalities","ausgaben","fs"
"36223","","Weitergabe eines Anteils am geografisch-topografischen Ausgleich an Gemeinden","Transmission d'une part de la compensation des charges excessives dues à des facteurs géo-topographiques aux communes","Trasferimento ai Comuni di una percentuale della perequazione geotopografica","Forwarding of a share in geographical/topographic equalization to municipalities","ausgaben","fs"
"36224","","Weitergabe eines Anteils am Härteausgleich an Gemeinden","Transmission d'une part de la compensation des cas de rigueur aux communes","Trasferimento ai Comuni di una percentuale della compensazione dei casi di rigore","Forwarding of a share in cohesion fund to municipalities","ausgaben","fs"
"36225","","Innerkantonaler vertikaler Finanzausgleich","Péréquation financière intracantonale verticale","Perequazione finanziaria intracantonale verticale","Intra-cantonal vertical fiscal equalization","ausgaben","fs"
"36226","","Innerkantonaler vertikaler Lastenausgleich","Compensation des charges intracantonale verticale","Compensazione degli oneri intracantonale verticale","Intra-cantonal vertical cost compensation","ausgaben","fs"
"36227","","Horizontaler Finanzausgleich von Gemeinde an Gemeinde","Péréquation financière horizontale : transferts entre communes","Perequazione finanziaria horizontale da Comune a Comune","Horizontal fiscal equalization between municipalities","ausgaben","fs"
"36228","","Horizontaler Lastenausgleich von Gemeinde an Gemeinde","Compensation horizontale des charges : transferts entre communes","Compensazione horizontale degli oneri da Comune a Comune","Horizontal cost compensation between municipalities","ausgaben","fs"
"3624","","Finanz- und Lastenausgleich an öffentliche Unternehmen","Péréquation financière et compensation des charges aux entreprises publiques","Perequazione finanziaria e compensazione degli oneri a imprese pubbliche","Fiscal equalization and cost compensation for public corporations","ausgaben","fs"
"3629","","Finanzausgleich n.a.g.","Péréquation financière n.c.a.","Perequazione finanziaria n.m.a.","Fiscal equalization n.e.c.","ausgaben","fs"
"363","","Beiträge an Gemeinwesen und Dritte","Contributions aux collectivités publiques et tiers","Contributi a enti pubblici e a terzi","Contributions to public authorities and third parties","ausgaben","fs"
"3630","","Beiträge an den Bund","Contributions à la Confédération","Contributi alla Confederazione","Contributions to the Confederation","ausgaben","fs"
"3631","","Beiträge an Kantone und Konkordate","Contributions aux cantons et concordats","Contributi a Cantoni e Concordati","Contributions to cantons and concordats","ausgaben","fs"
"3632","","Beiträge an Gemeinden und Gemeindezweckverbände","Contributions aux communes et syndicats intercommunaux","Contributi a Comuni e consorzi comunali","Contributions to municipalities and special purpose entities","ausgaben","fs"
"3633","","Beiträge an öffentliche Sozialversicherungen","Contributions aux assurances sociales publiques","Contributi ad assicurazioni sociali pubbliche","Contributions to social security funds","ausgaben","fs"
"3634","","Beiträge an öffentliche Unternehmen","Contributions aux entreprises publiques","Contributi a imprese pubbliche","Contributions to public corporations","ausgaben","fs"
"3635","","Beiträge an private Unternehmen","Contributions aux entreprises privées","Contributi a imprese private","Contributions to private corporations","ausgaben","fs"
"3636","","Beiträge an private Organisationen ohne Erwerbszweck","Contributions aux organisations privées à but non lucratif","Contributi a organizzazioni private senza scopo di lucro","Contributions to private non-profit organizations","ausgaben","fs"
"3637","","Beiträge an private Haushalte","Contributions aux ménages privés","Contributi a economie domestiche private","Contributions to households","ausgaben","fs"
"3638","","Beiträge an das Ausland","Contributions à l'étranger","Contributi all’estero","Contributions abroad","ausgaben","fs"
"3639","","Stipendien","Bourses","Borse di studio","Scholarships","ausgaben","fs"
"369","","Übrige Transferausgaben","Autres dépenses de transfert","Rimanenti in conto capitale","Other transfer expenditure","ausgaben","fs"
"38","","Ausserordentliche Ausgaben","Dépenses extraordinaires","Uscite straordinarie","Extraordinary expenditure","ausgaben","fs"
"380","","Ausserordentliche Personalausgaben","Dépenses de personnel extraordinaires","Uscite straordinarie per il personale","Extraordinary personnel expenditure","ausgaben","fs"
"381","","Ausserordentliche Sach- und Betriebsausgaben","Dépenses de biens et services et dépenses d'exploitation extraordinaires","Uscite straordinarie per beni e servizi e d’esercizio","Extraordinary general, administrative and operating expenditure","ausgaben","fs"
"384","","Ausserordentliche Finanzausgaben","Dépenses financières extraordinaires","Uscite finanziarie straordinarie","Extraordinary financial expenditure","ausgaben","fs"
"386","","Ausserordentliche Transferausgaben","Dépenses de transfert extraordinaires","Uscite di riversamento straordinarie","Extraordinary transfer expenditure","ausgaben","fs"
"3860","","Ausserordentliche Transferausgaben; Bund","Dépenses de transfert extraordinaires; Confédération","Uscite di riversamento straordinarie; Confederazione","Extraordinary transfer expenditure; Confederation","ausgaben","fs"
"3861","","Ausserordentliche Transferausgaben; Kantone und Konkordate","Dépenses de transfert extraordinaires; cantons et concordats","Uscite di riversamento straordinarie; Cantoni e Concordati","Extraordinary transfer expenditure; cantons and concordats","ausgaben","fs"
"3862","","Ausserordentliche Transferausgaben; Gemeinden und Gemeindezweckverbände","Dépenses de transfert extraordinaires; communes et syndicats intercommunaux","Uscite di riversamento straordinarie; Comuni e consorzi comunali","Extraordinary transfer expenditure; municipalities and special purpose entities","ausgaben","fs"
"3863","","Ausserordentliche Transferausgaben; öffentliche Sozialversicherungen","Dépenses de transfert extraordinaires; assurances sociales publiques","Uscite di riversamento straordinarie; assicurazioni sociali pubbliche","Extraordinary transfer expenditure; social security funds","ausgaben","fs"
"3864","","Ausserordentliche Transferausgaben; öffentliche Unternehmen","Dépenses de transfert extraordinaires; entreprises publiques","Uscite di riversamento straordinarie; imprese pubbliche","Extraordinary transfer expenditure; public corporations","ausgaben","fs"
"3865","","Ausserordentliche Transferausgaben; private Unternehmen","Dépenses de transfert extraordinaires; entreprises privées","Uscite di riversamento straordinarie; imprese private","Extraordinary transfer expenditure; private corporations","ausgaben","fs"
"3866","","Ausserordentliche Transferausgaben; private Organisationen ohne Erwerbszweck","Dépenses de transfert extraordinaires; organisations privées à but non lucratif","Uscite di riversamento straordinarie; organizzazioni private senza scopo di lucro","Extraordinary transfer expenditure; private non-profit organizations","ausgaben","fs"
"3867","","Ausserordentliche Transferausgaben; private Haushalte","Dépenses de transfert extraordinaires; ménages privés","Uscite di riversamento straordinarie; economie domestiche private","Extraordinary transfer expenditure; households","ausgaben","fs"
"3868","","Ausserordentliche Transferausgaben; Ausland","Dépenses de transfert extraordinaires; étranger","Uscite di riversamento straordinarie; estero","Extraordinary transfer expenditure; abroad","ausgaben","fs"
"5","","Investitionsausgaben","Dépenses d'investissement","Uscite per investimenti","Investment expenditure","ausgaben","fs"
"50","","Sachanlagen","Immobilisations corporelles","Investimenti materiali","Tangible fixed assets","ausgaben","fs"
"500","","Investitionsausgaben, Grundstücke","Dépenses d'investissement, biens-fonds","Uscite per investimenti, fondi","Investment expenditure, land","ausgaben","fs"
"503","","Investitionsausgaben, Tiefbau","Dépenses d'investissement, travaux de génie civil","Uscite per investimenti, opere del genio civile","Investment expenditure, civil engineering works","ausgaben","fs"
"504","","Investitionsausgaben, Hochbauten","Dépenses d'investissement, terrains bâtis","Uscite per investimenti, opere edili","Investment expenditure, building construction","ausgaben","fs"
"505","","Investitionsausgaben, Waldungen","Dépenses d'investissement, forêts","Uscite per investimenti, foreste","Investment expenditure, forests","ausgaben","fs"
"506","","Investitionsausgaben, Mobilien","Dépenses d'investissement, biens meubles","Uscite per investimenti, beni mobili","Investment expenditure, property, plant and equipment","ausgaben","fs"
"509","","Investitionsausgaben, übrige Sachanlagen","Dépenses d'investissement, autres immobilisations corporelles","Uscite per investimenti, rimanenti investimenti materiali","Investment expenditure, other tangible fixed assets","ausgaben","fs"
"51","","Investitionen auf Rechnung Dritter","Investissements pour le compte de tiers","Investimenti per conto di terzi","Investments on behalf of third parties","ausgaben","fs"
"510","","Investitionen Dritter, Grundstücke","Investissements pour le compte de tiers, biens-fonds","Investimenti di terzi, fondi","Third-party investments, land","ausgaben","fs"
"513","","Investitionen Dritter, Tiefbau","Investissements pour le compte de tiers, travaux de génie civil","Investimenti di terzi, opere del genio civile","Third-party investments, civil engineering works","ausgaben","fs"
"514","","Investitionen Dritter, Hochbauten","Investissements pour le compte de tiers, terrains bâtis","Investimenti di terzi, opere edili","Third-party investments, building construction","ausgaben","fs"
"515","","Investitionen Dritter, Waldungen","Investissements pour le compte de tiers, forêts","Investimenti di terzi, foreste","Third-party investments, forests","ausgaben","fs"
"516","","Investitionen Dritter, Mobilien","Investissements pour le compte de tiers, biens meubles","Investimenti di terzi, beni mobili","Third-party investments, property, plant and equipment","ausgaben","fs"
"519","","Investitionen Dritter, übrige Sachanlagen","Investissements pour le compte de tiers, autres immobilisations corporelles","Investimenti di terzi, rimanenti investimenti materiali","Third-party investments, other tangible fixed assets","ausgaben","fs"
"52","","Investitionen, immaterielle Anlagen","Investissements, immobilisations incorporelles","Investimenti immateriali","Investments, intangible fixed assets","ausgaben","fs"
"520","","Investitionen, Software","Investissements, logiciels","Investimenti, software","Investments, software","ausgaben","fs"
"521","","Investitionen, Lizenzen, Nutzungsrechte, Markenrechte","Investissements, licences, droits d'utilisation, droit des marques","Investimenti, licenze, diritti d'uso, diritti di marchio","Investments, licenses, rights of use, brand rights","ausgaben","fs"
"529","","Investitionen, übrige immaterielle Anlagen","Investissements, autres immobilisations incorporelles","Investimenti, rimanenti investimenti immateriali","Investments, other intangible fixed assets","ausgaben","fs"
"53","","Darlehen und Beteiligungen n.a.g.","Prêts et participations n.c.a.","Mutui e partecipazioni n.m.a.","Loans and financial interests n.e.c.","ausgaben","fs"
"530","","Darlehen und Beteiligungen n.a.g., Bund","Prêts et participations n.c.a., Confédération","Mutui e partecipazioni n.m.a., Confederazione","Loans and financial interests n.e.c., Confederation","ausgaben","fs"
"531","","Darlehen und Beteiligungen n.a.g., Kantone und Konkordate","Prêts et participations n.c.a., cantons et concordats","Mutui e partecipazioni n.m.a., Cantoni e Concordati","Loans and financial interests n.e.c., cantons and concordats","ausgaben","fs"
"532","","Darlehen und Beteiligungen n.a.g., Gemeinden und Gemeindezweckverbände","Prêts et participations n.c.a., communes et syndicats intercommunaux","Mutui e partecipazioni n.m.a., Comuni e consorzi comunali","Loans and financial interests n.e.c., municipalities and special purpose entities","ausgaben","fs"
